id;title;summary;category;sub_tags;platform_signals;source_url;source_name;published_at;synced_at;popularity;freshness;content_ready;dedup_key;created_at
ab93e055-6631-4c17-9993-0683ebc102e0;Day 1 - How to Go Viral and Grow Your Business - YouTube;Day 1 - How to Go Viral and Grow Your Business. 2.5K views ... AI and Content Strategy for Marketing. HighLevel. New. 235 views · 58:50.;Business;[];"[""web"",""news""]";https://www.youtube.com/watch?v=lPDzHxm-Hx0;youtube.com;;2026-06-16 05:54:16.9+00;43;50;true;Business:day1howtogoviralandgrowyourbusinessyoutube;2026-06-16 05:54:17.000605+00
1c7484ff-a422-40db-8acd-43b0d55caa42;Inside the Viral Growth Strategies That Are Driving 3 Brands' Sales ...;Discover the proven tactics used by top companies in skincare, baked goods, and home care to rapidly boost sales and reach new customers ...;Business;[];"[""web"",""news""]";https://www.uschamber.com/co/good-company/launch-pad/viral-growth-strategies-driving-success;uschamber.com;;2026-06-16 05:54:16.9+00;48;50;true;Business:insidetheviralgrowthstrategiesthataredriving3brandssales;2026-06-16 05:54:17.000605+00
cc76425c-6baa-483b-bd54-6630882efa51;This Viral Video Strategy is Working Like CRAZY - Reddit;I tested this new strategy for the past month, doing a mix of green screen/reaction/commentary or explainer content, and discovered a CHEAT CODE to going Viral.;Business;[];"[""web"",""news""]";https://www.reddit.com/r/SocialMediaMarketing/comments/1dkt83y/this_viral_video_strategy_is_working_like_crazy/;reddit.com;;2026-06-16 05:54:16.9+00;65;50;true;Business:thisviralvideostrategyisworkinglikecrazyreddit;2026-06-16 05:54:17.000605+00
3dc287e8-7a25-42b2-a7c4-9c0d584b8817;Viral Marketing Explained: How It Works, Key Examples, Pros & Cons;Viral marketing is a promotional strategy that leverages social media and digital platforms to rapidly disseminate a brand's message to a wide audience. Key ...;Business;[];"[""web"",""news""]";https://www.investopedia.com/terms/v/viral-marketing.asp;investopedia.com;;2026-06-16 05:54:16.9+00;73;50;true;Business:viralmarketingexplainedhowitworkskeyexamplesproscons;2026-06-16 05:54:17.000605+00
6114ecf0-08e8-4aa3-9a02-1171d70b4e7e;The coauthor of the viral Subsack report that rattled markets shares the investing strategy to guard against AI disruption;Alap Shah, who coauthored last month's viral AI thought experiment, told Business Insider about what he sees ahead and how to play the...;Business;[];"[""web"",""news""]";https://www.businessinsider.com/citrini-research-ai-report-alap-shah-stock-market-outlook-economy-2026-3;businessinsider.com;2026-03-25 00:00:00+00;2026-06-16 05:54:16.9+00;72;35;true;Business:thecoauthoroftheviralsubsackreportthatrattledmarketssharestheinvestingstrategyto;2026-06-16 05:54:17.000605+00
acf756cc-aa0b-4360-b637-29f80c17f237;‘Give Rs 10, take blessings’: Kid’s business strategy impresses netizens. Viral video;Social media users found the kid enterprising. Some even called him a 'baba' in the making for being able to understand 'the crux of...;Business;[];"[""web"",""news""]";https://www.moneycontrol.com/news/trends/give-rs-10-take-blessings-kid-s-business-strategy-impresses-netizens-viral-video-13808298.html;moneycontrol.com;2026-02-03 00:00:00+00;2026-06-16 05:54:16.9+00;47;35;true;Business:givers10takeblessingskidsbusinessstrategyimpressesnetizensviralvideo;2026-06-16 05:54:17.000605+00
50fd8600-f60e-4cce-86b2-89e1bd2a24f8;Omega Healthcare appoints Viral Bansal as Chief People Officer & Global Head of HR;As Chief People Officer and Global Head of HR, Bansal will focus on building a future-ready workforce, strengthening leadership pipelines,...;Business;[];"[""web"",""news""]";https://www.peoplematters.in/news/appointments/omega-healthcare-appoints-viral-bansal-as-chief-people-officer-and-global-head-of-hr-48957;peoplematters.in;2026-03-25 00:00:00+00;2026-06-16 05:54:16.9+00;56;35;true;Business:omegahealthcareappointsviralbansalaschiefpeopleofficerglobalheadofhr;2026-06-16 05:54:17.000605+00
04ac2366-390a-4345-b8c7-c651492520f7;Viral Brand Expert: The Strategy That Built Million-Dollar Brands;... Business and Content Creating 23:31 Why Going Viral Doesn't Mean ... New. 292K views · 39:59 · Go to channel Sabrina Ramonov · How This Mom ...;Business;[];"[""web"",""news""]";https://www.youtube.com/watch?v=c5xfuf7n0gA;youtube.com;;2026-06-15 05:43:02.587+00;35;50;true;Business:viralbrandexpertthestrategythatbuiltmilliondollarbrands;2026-06-13 05:49:22.353063+00
b4cf84e3-43c0-4416-beaf-755fbe7a6d64;strategy+business: international business strategy news articles and ...;Business strategy news articles for CEOs, corporate executives, and decision makers who influence international business management. Corporate strategy ...;Business;[];"[""web"",""news""]";https://www.strategy-business.com/;strategy-business.com;;2026-06-15 05:43:02.587+00;35;50;true;Business:strategybusinessinternationalbusinessstrategynewsarticlesand;2026-06-13 05:49:22.353063+00
a76e2714-b4bf-4234-ae65-971dc08fc031;Copy This Marketing Strategy It'll Blow Up Your Business - YouTube;Free AI Agency Course (+ $8273 in bonuses): https://adamerhart.co/3MtWEX2 ⚡ Extended 30-Day HighLevel Trial (Install the System + Unlock ...;Business;[];"[""web"",""news""]";https://www.youtube.com/watch?v=JYCkOIAVYCs;youtube.com;;2026-06-15 05:43:02.587+00;35;50;true;Business:copythismarketingstrategyitllblowupyourbusinessyoutube;2026-06-13 05:49:22.353063+00
5dc976a9-3fcd-4e3e-b575-ec886b0d19d3;Top 4 Business Strategies to Go Viral - Amplitudo;If you want to get your brand out there and gain a ton of new customers, creating viral content can be a huge help, and here are 4 ways to make algorithms like ...;Business;[];"[""web"",""news""]";https://amplitudo.me/blog/top-4-business-strategies-to-go-viral;amplitudo.me;;2026-06-15 05:43:02.587+00;35;50;true;Business:top4businessstrategiestogoviralamplitudo;2026-06-13 05:49:22.353063+00
bc585df3-93a8-4302-9904-d5e089449624;FYERS: Stocks & Option Trading - Apps on Google Play;FYERS provides a seamless way to trade stocks, futures, options, commodities, mutual funds, ETFs, IPOs, SGBs, and corporate bonds.;Custom;[];"[""web"",""news""]";https://play.google.com/store/apps/details?id=com.fyers.trader&hl=en_US;play.google.com;;2026-06-13 05:50:27.62+00;40;50;true;Custom:fyersstocksoptiontradingappsongoogleplay;2026-06-13 05:50:27.718741+00
672da98c-446f-49a2-ad14-f1321a8fe528;FYERS Platforms - YouTube;Markets and Discovery · Explore how to use screeners, news, watchlists, heatmaps, bubble charts, and more on FYERS to track the market and make informed ...;Custom;[];"[""web"",""news""]";https://www.youtube.com/channel/UCCOTK4jjJp97YUFfPzKAfbA;youtube.com;;2026-06-13 05:50:27.62+00;44;50;true;Custom:fyersplatformsyoutube;2026-06-13 05:50:27.718741+00
d5d5b4e5-1caf-44e6-9d3d-e61d5c8f8cc7;Viral Marketing - Inc. Magazine;Read the latest Viral Marketing news for entrepreneurs and small businesses from Inc. See related articles, photos, videos and podcasts.;Business;[];"[""web"",""news""]";https://www.inc.com/viral-marketing;inc.com;;2026-06-15 05:43:02.587+00;35;50;true;Business:viralmarketingincmagazine;2026-06-13 05:49:22.353063+00
a837de2b-718f-40c6-92c0-446f268b0e93;Unusual Marketing Strategy That Went Viral – A Must-Know for ...;Unusual Marketing Strategy That Went Viral – A Must- Know for Business Growth! Marketing in business requires creativity, ...;Business;[];"[""web"",""news""]";https://www.facebook.com/badabusinesspvtltd/videos/unusual-marketing-strategy-that-went-viral-a-must-know-for-business-growthmarket/1219391429747580/;facebook.com;;2026-06-15 05:43:02.587+00;35;50;true;Business:unusualmarketingstrategythatwentviralamustknowfor;2026-06-13 05:49:22.353063+00
ab67928a-1201-48ca-8a24-1b7f228e09db;FYERS: Online Stock Trading & Investment Platform in India;FIA is a complete AI-powered assistant. It monitors markets in real-time, spots patterns, analyses news and builds tailored screeners for stocks, F&O and ...;Custom;[];"[""web"",""news""]";https://fyers.in/;fyers.in;;2026-06-13 05:50:27.62+00;35;50;true;Custom:fyersonlinestocktradinginvestmentplatforminindia;2026-06-13 05:50:27.718741+00
fe00e674-79ca-4e7b-b058-39967088db91;FYERS is the WORST broker : r/IndianStreetBets - Reddit;FYERS were the first stockbroker to give trading view charts on their platform and after few years later many started giving the trading view ...;Custom;[];"[""web"",""news""]";https://www.reddit.com/r/IndianStreetBets/comments/18snwan/fyers_is_the_worst_broker/;reddit.com;;2026-06-13 05:50:27.62+00;35;50;true;Custom:fyersistheworstbrokerrindianstreetbetsreddit;2026-06-13 05:50:27.718741+00
58d4756f-217b-4486-b5f1-e5d5d00d2356;Fyers Review, Forex Broker&Trading Markets, Legit or a Scam-WikiFX;Founded in 2013, Fyers is an unregulated company that offers trading platforms and tools to help investors trade equities, futures, options, debts, funds, ...;Custom;[];"[""web"",""news""]";https://www.wikifx.com/en/dealer/1949847052.html;wikifx.com;;2026-06-13 05:50:27.62+00;35;50;true;Custom:fyersreviewforexbrokertradingmarketslegitorascamwikifx;2026-06-13 05:50:27.718741+00
c013bae7-68db-49a3-b8e1-b61c470cded2;Lodi's social media strategy pays off, turning local businesses into viral success stories;Imagine you're a new business in a small town, and the city's social media manager walks into your store and asks to feature your business...;Business;[];"[""web"",""news""]";https://www.cbsnews.com/sacramento/news/lodis-social-media-local-businesses-viral/;cbsnews.com;2025-10-03 00:00:00+00;2026-06-15 05:43:02.587+00;49;35;true;Business:lodissocialmediastrategypaysoffturninglocalbusinessesintoviralsuccessstories;2026-06-13 05:49:22.353063+00
622092d2-1736-4f1b-9ce5-00d58e66d921;What Is ‘Clipping,’ the Viral Marketing Strategy That’s Taking Over the Music Biz?;Over the past year, 'clipping' has grown from a promotional tool in the livestream space to a key strategy for promoting artist content.;Business;[];"[""web"",""news""]";https://variety.com/2026/music/news/clipping-marketing-tool-took-over-music-industry-1236699705/;variety.com;2026-03-26 00:00:00+00;2026-06-15 05:43:02.587+00;42;35;true;Business:whatisclippingtheviralmarketingstrategythatstakingoverthemusicbiz;2026-06-13 05:49:22.353063+00
f0bc5dc7-eeb4-4560-bb78-eae0c6c85bce;FYERS: Stocks & Option Trading - App Store - Apple;FYERS provides a seamless way to trade stocks, futures, options, commodities, mutual funds, ETFs, IPOs, SGBs, and corporate bonds.;Custom;[];"[""web"",""news""]";https://apps.apple.com/us/app/fyers-stocks-option-trading/id1526652184;apps.apple.com;;2026-06-13 05:50:27.62+00;35;50;true;Custom:fyersstocksoptiontradingappstoreapple;2026-06-13 05:50:27.718741+00
ee22c834-6108-43ec-86a3-4703e76382ee;Inside the Viral Growth Strategies That Are Driving 3 Brands' Sales Success;Discover the proven tactics used by top companies in skincare, baked goods, and home care to rapidly boost sales and reach new customers...;Business;[];"[""web"",""news""]";https://www.uschamber.com/co/good-company/launch-pad/viral-growth-strategies-driving-success;uschamber.com;2025-10-27 00:00:00+00;2026-06-15 05:43:02.587+00;35;35;true;Business:insidetheviralgrowthstrategiesthataredriving3brandssalessuccess;2026-06-13 05:49:22.353063+00
d7150446-d7a7-43c9-9dd1-673cce8aa2fa;Best Startups with Recent Funding in 2026;Explore the top startups that recently raised funding rounds from leading investors. Stay updated with latest funding news in AI, fintech, and more.;Funding;[];"[""web"",""news""]";https://startups.gallery/news;startups.gallery;;2026-06-13 10:06:57.011+00;35;50;true;Funding:beststartupswithrecentfundingin2026;2026-06-13 05:49:20.484688+00
66cd5be0-d01f-468d-b015-427bad69b05f;Tech Funding News | Global technology startup funding news;Get latest updates on the best funding news from technology startups across the globe. Covering AI, fintech, crypto, VC funding and more.;Funding;[];"[""web"",""news""]";https://techfundingnews.com/;techfundingnews.com;;2026-06-13 10:06:57.011+00;35;50;true;Funding:techfundingnewsglobaltechnologystartupfundingnews;2026-06-13 05:49:20.484688+00
034d55a2-2a62-4d00-9b6b-b0d804d6a7c4;List of Funded Series A Startups (2026) - Fundraise Insider;Exceptionally Large Series A Startup Rounds (>$47.5 M) · Apptronik – $350 M on 2025-02-26 · QuEra Computing – $230 M on 2025-04-11 · Tenvie ...;Funding;[];"[""web"",""news""]";https://fundraiseinsider.com/blog/series-a-startups/;fundraiseinsider.com;;2026-06-13 10:06:57.011+00;35;50;true;Funding:listoffundedseriesastartups2026fundraiseinsider;2026-06-13 05:49:20.484688+00
af042806-cf45-42a0-b69e-c1313ca39e47;Top Series A Startups 2026 — Sequoia, YC, A16Z, Benchmark;"Track new startups funded by top investors. Powerful filters. Updates daily. Leaders at $1B+ startups; General Catalyst $20M Series A in 2025";Funding;[];"[""web"",""news""]";https://topstartups.io/?funding_round=Series%20A;topstartups.io;;2026-06-13 10:06:57.011+00;35;50;true;Funding:topseriesastartups2026sequoiayca16zbenchmark;2026-06-13 05:49:20.484688+00
bf3e2edc-2dfa-4cef-862d-bc7101fa1ee7;VC News Daily: Venture Capital Financings and Technology Startups;Minerva Launches with $20M Funding · F2 Bags $14M Seed Round · Valor Closes Series B Financing Round · Turnout Grabs $35M Series A Funding Round · Digital Asset ...;Funding;[];"[""web"",""news""]";https://vcnewsdaily.com/;vcnewsdaily.com;;2026-06-13 10:06:57.011+00;40;50;true;Funding:vcnewsdailyventurecapitalfinancingsandtechnologystartups;2026-06-13 05:49:20.484688+00
f7e8daf3-3028-4f9f-97aa-ce79ff39d77f;First Round: Home;We're focused on being the world's best partner for founders at the very first stages of company creation — so we've designed First Round to do just that.;Funding;[];"[""web"",""news""]";https://www.firstround.com/;firstround.com;;2026-06-13 10:06:57.011+00;49;50;true;Funding:firstroundhome;2026-06-13 05:49:20.484688+00
5a4d191c-508c-4bc7-b54f-116e32333d20;Burger King names 2 new agencies following viral Whopper bite moment;Mojo Supermarket, now the chain's U.S. social AOR, claimed credit for a video swiping at McDonald's CEO Chris Kempczinski's awkward Big Arch...;Business;[];"[""web"",""news""]";https://www.marketingdive.com/news/burger-king-names-2-new-agencies-following-viral-whopper-bite-moment/814166/;marketingdive.com;2026-03-09 00:00:00+00;2026-06-15 05:43:02.587+00;35;35;true;Business:burgerkingnames2newagenciesfollowingviralwhopperbitemoment;2026-06-13 05:49:22.353063+00
ee61462c-788e-4280-9b01-c8f11a171566;Labubu success demonstrates the benefits of the ‘blind box’ business strategy;Isabel Bequer July 30, 2025. Share. Labubu dolls have taken the world by storm. The viral collectable keychains that feature plush monster-like figurines,...;Business;[];"[""web"",""news""]";https://news.ufl.edu/2025/07/labubu/;news.ufl.edu;2025-07-30 00:00:00+00;2026-06-15 05:43:02.587+00;44;35;true;Business:labubusuccessdemonstratesthebenefitsoftheblindboxbusinessstrategy;2026-06-13 05:49:22.353063+00
8b311af9-7578-4ed3-97cb-e09ec0dc3b31;Fresh off its president's viral moment, Burger King kicks off a big, new ad campaign;The fast-food chain admits mistakes of the past, and fires The King, in an ambitious new marketing campaign featuring the brand's.;Business;[];"[""web"",""news""]";https://restaurantbusinessonline.com/marketing/fresh-its-presidents-viral-moment-burger-king-kicks-big-new-ad-campaign;restaurantbusinessonline.com;2026-03-15 00:00:00+00;2026-06-15 05:43:02.587+00;42;35;true;Business:freshoffitspresidentsviralmomentburgerkingkicksoffabignewadcampaign;2026-06-13 05:49:22.353063+00