id;user_id;thread_id;topic;data;created_at;folder
4f248c44-1d43-4f9f-b8e9-fba0ad825654;fe7d32af-a848-4697-b205-62382fe8539b;00ac37e2-b3cf-4f54-992e-69cd271b137e;Rapido $3 Billion Valuation vs Uber;"{""caption"":""Rapido is now a $3 Billion giant! 🚕💨 Here is how they are taking on Uber and Ola. #Startups #BusinessStory #Rapido"",""hashtags"":[""#Rapido"",""#UberIndia"",""#StartupFunding"",""#BusinessStrategy"",""#Unicorn"",""#Entrepreneurship"",""#IndianStartups"",""#MoneyNews"",""#SuccessStory"",""#CaseStudy""],""onScreenText"":[""Uber ka sabse bada darr!"",""$3 Billion Valuation?"",""2-Wheeler Power"",""Market Share War"",""The Winner?""],""script"":""Kya aapko lagta hai Uber aur Ola ko haraana namumkin hai? Rapido ne kar dikhaya! \n\nAbhi-abhi Rapido ne $240 million ki funding uthayi hai aur inki valuation pahunch gayi hai $3 Billion dollar! Par kaise? \n\nJab Uber aur Ola badi AC gaadiyon ke peeche bhaag rahe the, Rapido ne pakda India ki nabz—Traffic! Inhone bike-taxis ko mainstream banaya jo sasti bhi hain aur tez bhi. \n\nResult? Aaj Rapido sirf bikes nahi, autos aur cabs mein bhi Uber ko takkar de raha hai. Prosus jaise bade investors ab inpar paisa laga rahe hain kyunki India ke mass market ko \""premium\"" nahi, \""practical\"" solution chahiye. \n\nStartup lesson: Market leader ko haraane ke liye bada hona zaroori nahi, different hona zaroori hai. \n\nKya aap Rapido use karte ho ya Uber? Comments mein batao!"",""sourcesToVerify"":[""Rapido $240M funding round amount"",""Rapido $3 Billion valuation figure"",""Prosus leading the investment round""],""thumbnailOptions"":[""Uber vs Rapido: Who wins?"",""$3 Billion ka \""Bike\"" Startup!"",""Rapido ne Uber ko peeche chhoda?""],""topic"":""Rapido $3 Billion Valuation vs Uber"",""visualDirection"":[""Fast montage of chaotic Indian traffic with Rapido bikes zooming past stuck cars."",""Split screen: Uber logo vs Rapido logo with a 'Vs' symbol."",""Headline screenshot of the $240M funding news."",""Close up of a phone screen showing the Rapido app interface."",""Fast cuts of people using bike taxis and autos in busy streets."",""Host looking directly at camera for the final lesson and CTA.""],""voiceoverStyle"":""High energy, fast-paced, dramatic pauses after mentioning the $3B figure. Professional yet conversational."",""whyViral"":""Relatable everyday service (bike taxi) combined with a massive financial milestone ($3B) creates curiosity about how an underdog is winning.""}";2026-06-09 19:12:33.814665+00;
2f2657ce-ea7b-49b1-a5a8-312a76c1af2f;fe7d32af-a848-4697-b205-62382fe8539b;00ac37e2-b3cf-4f54-992e-69cd271b137e;Daily vs Monthly SIP Reality Check;"{""caption"":""Daily vs Monthly SIP: Kaunsa hai better? 💰 My analysis will surprise you! #InvestingTips #PersonalFinance #SIP #WealthBuilding"",""hashtags"":[""#SIP"",""#MutualFundsIndia"",""#InvestingTips"",""#PersonalFinance India"",""#StockMarketIndia"",""#FinancialFreedom"",""#WealthManagement"",""#MoneyHacks""],""onScreenText"":[""Daily vs Monthly SIP?"",""The Big Debate!"",""Backtesting Results"",""Which wins?"",""Psychology vs Science""],""script"":""Kya aap bhi roz ₹100 ki Daily SIP karne ki soch rahe ho? Log kehte hain isse compounding fast hogi, par sach kuch aur hi hai! \n\nTheoretical analysis aur backtesting data ye kehta hai ki 10 saal ke horizon mein, Daily, Weekly aur Monthly SIP ke returns mein 0.5% se bhi kam ka fark hota hai. \n\nTo fir Daily SIP kyun famous ho rahi hai? Ye sirf ek psychological game hai. Un logo ke liye jo paisa kharch kar dete hain, unka discipline maintain rehta hai. \n\nLekin maths ki suno toh, Monthly SIP best hai—kyunki isme transactions kam hote hain, bank statement clean rehti hai aur long term compounding \""time in the market\"" se hoti hai, frequency se nahi! \n\nStrategy simple rakho: SIP ki date fixed karo aur bhool jao. Kya aapne apni SIP start ki? Comments mein batao!"",""sourcesToVerify"":[""Historical backtesting data comparing Daily vs Monthly SIP returns (mostly shows negligible difference)"",""Impact of transaction frequency on bank statements/tracking""],""thumbnailOptions"":[""Daily SIP is a SCAM? 😱"",""Monthly vs Daily: Best SIP?"",""Mat karo Daily SIP! (Analysis)""],""topic"":""Daily vs Monthly SIP Reality Check"",""visualDirection"":[""A person looking at a phone screen looking confused with 'Daily?' and 'Monthly?' bubbles."",""A bar graph showing almost equal height for Daily/Weekly/Monthly returns."",""Fast scroll of a very messy bank statement with too many small entries."",""A clean calm animation of a money tree growing slowly (Monthly)."",""Host doing a 'Stop' hand gesture to camera.""],""voiceoverStyle"":""Knowledgeable, debunking myths, confident and clear. Slow down for the \""0.5%\"" fact."",""whyViral"":""It debunked a popular social media trend (Daily SIP) using math and logic, which usually triggers high engagement and debate in the comments.""}";2026-06-09 19:13:33.926689+00;
cfb7024c-32c1-4b77-8953-2e12a29b5160;968de976-deb8-4d42-936b-0e4288e99c82;17e3da58-1f7a-4b49-a024-c5d0a2f16f1f;13-Year-Old Jaiwardhan Tyagi's Viral AI Pitch on Shark Tank India;"{""caption"":""Age is just a number when your AI game is this strong! 🤖 Jaiwardhan Tyagi just proved that Gen Z is ready to lead the tech revolution. 🚀 #SharkTankIndia #StartupIndia #AI #Entrepreneurship #JaiwardhanTyagi #IndianStartups"",""format"":""Instagram Reel / YouTube Short"",""hashtags"":[""#SharkTankIndia"",""#AIStartup"",""#JaiwardhanTyagi"",""#Entrepreneurship"",""#BusinessNews"",""#StartupIndia"",""#GenZFounder"",""#FundingNews"",""#TechIndia"",""#SharkTankSeason5""],""niche"":""Business/Startups"",""script"":{""dialogue"":""Kya ek 13 saal ka bachcha AI revolution lead kar sakta hai? Shark Tank India Season 5 mein enters Jaiwardhan Tyagi. Ghaziabad ka ye ladka apne AI startup, Neurapexai ke saath aaya aur Sharks ke hosh uda diye. No extra gyaan, seedha business. Jab Sharks ne numbers aur tech pucha, Jaiwardhan was ready. Result? 60 Lakh Rupees ki investment for 5% equity. Ye sirf ek deal nahi hai, ye message hai ki India ki next big tech wave school se nikal rahi hai. 13 saal ki age mein funding uthana koi mazak nahi hai boss. Aap abhi tak kya build kar rahe ho? Comment mein batao."",""suggestedElevenLabsVoice"":{""name"":""Marcus"",""voiceId"":""z9fAnlkSfk3W1iJC8L5P""},""voiceDirection"":""High energy, fast-paced, founder-like authority. Deeply impressed tone. Natural pauses after rhetorical questions. No robotic feel.""},""sources"":[{""claim"":""13-year-old Jaiwardhan Tyagi from Ghaziabad secured a ₹60 lakh investment for 5% equity on Shark Tank India Season 5 for his AI startup, Neurapexai."",""url"":""https://www.instagram.com/reel/DY9cF4XTEyS/""}],""thumbnailPrompts"":[""Close-up of a confident 13-year-old boy standing in front of the Shark Tank India backdrop, cinematic lighting, text overlay: \""13 YEAR OLD SECURES 60 LAKHS!\"" in bold yellow and white."",""Split screen: A Shark judge looking shocked on the left, 13-year-old Jaiwardhan Tyagi pitching on the right. Large text: \""THE COOLEST PITCH EVER?\"" with a neon AI icon in the middle."",""Wide shot of the Shark Tank set, all Sharks leaning forward in interest, glowing AI neural network graphics floating in the air. Text: \""GEN-Z IS TAKING OVER!\"" neon blue aesthetic.""],""topic"":""13-Year-Old Jaiwardhan Tyagi's Viral AI Pitch on Shark Tank India"",""visuals"":[{""beat"":""0-3s hook"",""imagePrompt"":""Close-up of a young boy (13-year-old Jaiwardhan Tyagi) looking intensely at the camera with a futuristic AI interface reflected in his eyes. High-end cinematic lighting, sharp focus."",""onScreenText"":""13-Year-Old AI Genius?"",""videoPrompt"":""A fast zoom-in on a young founder's face with a digital HUD overlay appearing on screen. Professional TV-grade production quality.""},{""beat"":""4-12s pitch reveal"",""imagePrompt"":""A wide shot of the Shark Tank India set with Shark judges looking stunned. In the center is a young boy explaining tech on a large LED screen. High contrast, studio lighting."",""onScreenText"":""Neurapexai: The Future?"",""videoPrompt"":""Dolly shot across the Sharks' faces as they exchange surprised glances, moving into a shot of Jaiwardhan confidently presenting his deck.""},{""beat"":""13-25s the deal"",""imagePrompt"":""A dramatic low-angle shot of a digital check for 60 Lakhs merging with falling lines of binary code. The background is the Shark Tank logo. Vibrant gold and blue tones."",""onScreenText"":""₹60 LAKH DEAL!"",""videoPrompt"":""3D text of '₹60,00,000' spinning and locking into place with a 'Deal Locked' sound effect visual across the screen. 120fps slow motion.""},{""beat"":""26-40s takeaway"",""imagePrompt"":""A futuristic classroom where kids are using holograms to build robots. Bright, inspiring, high-tech Indian school setting. Soft sun-drenched lighting."",""onScreenText"":""The Next Tech Wave is Here."",""videoPrompt"":""A montage of young entrepreneurs in India working on laptops and soldering circuits, ending with the speaker pointing directly at the camera. High energy transitions.""}],""whyViral"":""The 'Young Prodigy' trope combined with the 'AI' hype and a massive 60 Lakh deal is the perfect recipe for high retention and shareability among students, parents, and tech enthusiasts.""}";2026-06-10 05:08:57.036479+00;
6c07d09c-14f5-46bc-bb56-e225ad540079;968de976-deb8-4d42-936b-0e4288e99c82;971c44e1-5d0f-4aaf-bff0-1aa0c22861a5;The $30 Million High School Founder: Zach Yadegari;"{""caption"":""19 years old and a $30 Million exit? 🤯 Zach Yadegari just proved that age is no longer a barrier to building massive companies. From high school hallways to a life-changing acquisition by MyFitnessPal. Here is how he did it. 🚀\n\n#StartupStory #Entrepreneurship #ZachYadegari #CalAI #FounderSecrets #TechNews #BusinessGrowth #Inspiration"",""format"":""Reel/Short"",""hashtags"":[""#startupstory"",""#entrepreneurship"",""#zachyadegari"",""#founderlife"",""#technology"",""#businessstrategy"",""#successmindset"",""#venturecapital""],""niche"":""Business/Startups"",""script"":{""dialogue"":""Building a thirty million dollar company is hard. Doing it while you’re still in high school? That’s next level. This is nineteen year old Zach Yadegari. While most kids his age were worrying about prom or college apps, Zach was building Cal AI—an artificial intelligence tool that tracks your calories just by looking at a photo of your food. No more manual logging, no more guessing. It went viral, grew fast, and then the unthinkable happened. MyFitnessPal, the absolute giant of the industry, stepped in and acquired it for thirty million dollars. Zach didn't just get lucky. He saw a friction point—logging food sucks—and solved it with AI before anyone else could react. Now at nineteen, he’s starting his next venture, Flow. The lesson? The market doesn't care about your age, it only cares about the value you create. Stop waiting for 'the right time' and start building."",""suggestedElevenLabsVoice"":{""name"":""Marcus"",""voiceId"":""zY6p8j0g3X4U1Yp0Y2X1""},""voiceDirection"":""Direct, punchy, confident 'Founder' tone. No fluff. Significant pauses after the price tag and the final punchline. Sharp delivery.""},""sources"":[{""claim"":""19-year-old Zach Yadegari sold his AI calorie-tracking startup Cal AI to MyFitnessPal for $30 million."",""url"":""https://www.businessinsider.com/cal-ai-myfitnesspal-calorie-tracker-teen-founder-flow-zack-yadegari-2026-6""},{""claim"":""Zach Yadegari is now working on a new productivity brand called Flow."",""url"":""https://www.facebook.com/Insiderinventions/posts/zach-yadegari-19-has-already-launched-two-apps-and-a-new-productivity-brand-call/1362893939037060/""}],""thumbnailPrompts"":[""Close-up cinematic shot of 19-year-old Zach Yadegari, split screen: left side high school classroom, right side a high-end boardroom. Bold text: $30M HIGH SCHOOLER."",""A glowing smartphone displaying a food photo being scanned by AI. Overhead text in neon: HE SOLD THIS FOR $30,000,000. Reaction face of a young founder in the corner."",""Minimalist aesthetic. Zach Yadegari looking at a laptop with a giant 'SOLD' sign on the screen. Big text: AGE AINT A LIMIT. Low angle, powerful lighting.""],""topic"":""The $30 Million High School Founder: Zach Yadegari"",""visuals"":[{""beat"":""0-5s hook"",""imagePrompt"":""Cinematic portrait of a confident 19-year-old entrepreneur in a modern tech office, warm lighting, shallow depth of field, sharp focus on eyes. Style: Forbes 30 under 30 photography."",""onScreenText"":""$30,000,000 BEFORE 20?"",""videoPrompt"":""Slow motion zoom into the eyes of a young founder standing in an office. Light leaks and high-end cinematic color grading.""},{""beat"":""5-15s background"",""imagePrompt"":""Split screen: A teenager in a hoodie sitting in a messy high school bedroom with a laptop, contrasted with a sleek corporate HQ building. High contrast, dramatic lighting."",""onScreenText"":""MEET ZACH YADEGARI"",""videoPrompt"":""Quick jump cuts between a high school hallway and a fast-paced coding environment on a high-end monitor.""},{""beat"":""15-30s the product"",""imagePrompt"":""POV of a smartphone scanning a plate of sushi. Holographic UI elements floating over the food showing calorie counts and protein. Futuristic tech aesthetic."",""onScreenText"":""THE CAL AI STORY"",""videoPrompt"":""Handheld shot of a phone 'scanning' food with digital particles flying from the food to the screen. Smooth motion graphics overlay.""},{""beat"":""30-45s the exit"",""imagePrompt"":""A massive billboard in Times Square showing the MyFitnessPal logo and 'Acquisition' in bold letters. Night time, neon city lights, 4k."",""onScreenText"":""SOLD FOR $30 MILLION"",""videoPrompt"":""A rapid zoom-out from a dollar sign to show a giant corporate logo. Use glitch transitions for high energy.""},{""beat"":""45-60s the lesson"",""imagePrompt"":""Zach Yadegari standing on a rooftop overlooking a city skyline at sunset. Low angle shot, heroic lighting, cinematic wide lens."",""onScreenText"":""VALUE > AGE. START NOW."",""videoPrompt"":""A slow tracking shot around the founder as the sun sets behind him, creating a flare effect. Fade to black with bold text.""}],""whyViral"":""Youth success stories are high-performing magnets for both inspiration and controversy. The '$30M in high school' hook creates immediate FOMO and curiosity, while the 'problem-solution' breakdown provides actual value to aspiring entrepreneurs.""}";2026-06-10 06:38:38.513145+00;
517fe861-e3c9-4fd1-935d-8170c55fba3e;968de976-deb8-4d42-936b-0e4288e99c82;0fcc433b-0e43-4012-bcd8-02f667c07e36;The AI Takeover of Finance (2025 Trends);"{""caption"":""Fintech is dead? Think again. AI startups are raising billions while traditional banks are still figuring out PDFs. Here’s how the 'Money Game' is changing in 2025. 💸🤖\n\n#Fintech #ArtificialIntelligence #Startups #Money #FutureOfFinance #TechNews #Funding #VentureCapital"",""format"":""Reel/Short"",""hashtags"":[""#Fintech"",""#AIRevolution"",""#Startups2025"",""#MoneyTips"",""#StartupFunding"",""#TechTrends"",""#BusinessNews"",""#CodingLife"",""#Entrepreneurship""],""niche"":""Business & Tech"",""script"":{""dialogue"":""Kya aapko lagta hai Fintech funding khatam ho chuki hai? Bilkul nahi. Ulta, 2025 mein AI startups ne total venture capital ka 41 percent capture kar liya hai. Monarch jaise startups ne 'nuclear winter' ke beech 75 million dollars raise kiye hain. Aur Rogo? Is finance tool ne 150 million dollars raise kiye hain. Ab banks sirf apps nahi, balki intelligent agents ban rahe hain jo aapka tax, compliance aur investment bina kisi human help ke manage karenge. Agar aap building ya investing kar rahe ho, toh yaad rakhna—ab game sirf 'finance' ka nahi, specialized AI agents ka hai. Kya aap apna paisa ek AI robot ko trust karenge? Comments mein batao!"",""suggestedElevenLabsVoice"":{""name"":""Drew"",""voiceId"":""21mOQcy75Jp17UdhW82V""},""voiceDirection"":""Fast-paced, energetic, punchy delivery. High emphasis on numbers like '41 percent' and '75 million'. Direct and questioning tone at the end.""},""sources"":[{""claim"":""AI startups captured 41% of all venture dollars on the platform in 2025."",""url"":""https://www.crescendo.ai/news/latest-vc-investment-deals-in-ai-startups""},{""claim"":""Monarch raises $75 million despite 'nuclear winter' for fintech startups."",""url"":""https://burklandassociates.com/news/""},{""claim"":""Rogo, AI finance tools, $150 M"",""url"":""https://www.forbes.com/lists/ai50/""}],""thumbnailPrompts"":[""A dramatic split screen: On one side, a dusty old bank vault. On the other, a glowing blue robotic hand holding a digital gold coin. Text: 'FINTECH IS NOT DEAD' in bold yellow."",""Extreme close-up of a futuristic eye reflecting stock market charts. Text: '41% of ALL VC MONEY' in bright white, 3D font. Impactful and tech-heavy style."",""A person looking shocked at a phone screen showing a $75M notification. Background has floating dollar signs and AI circuit patterns. Text: 'THE AI MONEY HEIST' in red.""],""topic"":""The AI Takeover of Finance (2025 Trends)"",""visuals"":[{""beat"":""0-3s Hook"",""imagePrompt"":""A futuristic digital landscape with a massive golden dollar sign being scanned by blue laser beams. Cinematic lighting, 8k resolution, high contrast."",""onScreenText"":""Fintech DEAD? Think again."",""videoPrompt"":""Fast zoom into a digital dollar icon that shatters into binary code, revealing a glowing AI brain inside. High-speed cinematic motion.""},{""beat"":""3-8s The Data Reveal"",""imagePrompt"":""A futuristic bar chart showing one massive bar labeled 'AI' towering over others. Sleek glass-morphism UI design, dark background with neon blue accents."",""onScreenText"":""41% of ALL VC Money is going here!"",""videoPrompt"":""Dynamic camera panning across a 3D bar graph that grows rapidly. Neon lights pulse through the bars as they hit the peak.""},{""beat"":""8-13s The Specific Examples"",""imagePrompt"":""A sleek, modern office building with 'MONARCH' and 'ROGO' logos glowing on the facade. High-end architectural photography, sunset lighting."",""onScreenText"":""Monarch: $75M | Rogo: $150M"",""videoPrompt"":""Split screen showing a fast-paced montage of bank trading floors and high-tech server rooms with glowing data cables.""},{""beat"":""13-18s The Future Vision"",""imagePrompt"":""A holographic AI assistant floating above a smartphone, sorting stacks of digital gold coins. Soft bokeh background of a modern city."",""onScreenText"":""AI Agents = New Banks?"",""videoPrompt"":""A smooth orbit shot around a smartphone where a 3D AI avatar is flicking through complex financial graphs with lightning speed.""},{""beat"":""18-22s Call to Action"",""imagePrompt"":""A human hand reaching out to shake a robotic hand. Dramatic lighting, dark background, focus on the point of contact."",""onScreenText"":""Would YOU trust a bot?"",""videoPrompt"":""A slow-motion close-up of the human and robot hands touching, with a digital spark igniting between them as the screen fades to black.""}],""whyViral"":""It debunks the 'Fintech is dead' myth with hard numbers (41% VC share) and names massive funding rounds, triggering both FOMO and curiosity about the future of money.""}";2026-06-10 06:51:05.996856+00;
bb0f387d-4dff-43fd-beba-ec5dabb0d851;fe7d32af-a848-4697-b205-62382fe8539b;26dbe7ae-534d-4bad-9cc9-c041142d0c6c;Shark Tank India: The Nasher Miles Salary Controversy;"{""caption"":""Startup founder taking 7 Lakh salary? 🤯 Shark Tank India Season 3 just got personal. Nasher Miles ki journey aur ye controversy aapko kya sikhati hai? Dekhiye poora video! 🚀\n\n#SharkTankIndia #StartupIndia #NasherMiles #FounderLife #BusinessStrategy #Entrepreneurship #SharkTankIndiaSeason3 #SonyLIV"",""format"":""Reel/Short"",""hashtags"":[""SharkTankIndia"",""StartupIndia"",""NasherMiles"",""BusinessStrategy"",""Entrepreneurship"",""FounderLife"",""MoneyManagement"",""SharkTankSeason3"",""TrendingIndia""],""niche"":""Business/Startups"",""script"":{""dialogue"":""Shark Tank par pitch toh bohot aati hain, par Nasher Miles ke founders ne kuch aisa kaha jisne Sharks ke hosh uda diye. Imagine karo, ek startup jo funding maangne aaya hai, uske founders 7 lakh rupaye mahina salary le rahe hain! Jab Sharks ne ye suna, toh reaction dekhne layak tha. Sawaal simple tha: Kya itni high salary lena sahi hai? Lekin yahan ek twist hai. Business scale aur fundamentals solid hon toh shayad rules badal jaate hain. Lesson clear hai doston—agar aapka dhandha solid hai, toh aap rules khud likhte ho. Par agar burn par zinda ho, toh founders ki salary pehla shikaar hoti hai. Kya aapko lagta hai founders ki itni salary justified hai? Tell me in the comments!"",""suggestedElevenLabsVoice"":{""name"":""Antoni"",""voiceId"":""ErXw9S1aaFseS63K4f6c""},""voiceDirection"":""Confident, fast-paced, founder-like energy. Use dramatic pauses after '7 lakh rupaye'. Authority combined with curiosity.""},""sources"":[{""claim"":""Nasher Miles founders revealed taking nearly 7 lakh per month salary on Shark Tank India Season 3."",""publisher"":""Instagram/News Source via Search"",""url"":""https://www.instagram.com/reel/DYkM9JPu--b/""},{""claim"":""Sharks were shocked when Nasher Miles' founders revealed they were taking nearly ₹7 lakh per month in salary on Shark Tank India Season 3."",""publisher"":""Instagram/News Source via Search"",""url"":""https://www.instagram.com/reel/DYW_q4WTxo_/?hl=en""}],""thumbnailPrompts"":[""Close-up of a shocked Indian Shark with bold text '7 LAKH SALARY??' in bright yellow, high contrast background."",""Splitscreen: Nasher Miles luggage bags on one side, a huge stack of cash on the other. Text: 'PRUDENT OR GREEDY?' in red and white."",""Founder standing confidently in front of the Shark Tank set. Text: 'SALARY DEBATE' with a 3D glass effect overlay.""],""topic"":""Shark Tank India: The Nasher Miles Salary Controversy"",""visuals"":[{""beat"":""0-5s Hook"",""imagePrompt"":""Cinematic shot of the Shark Tank India set, neon lights, empty chairs, dramatic smoke, high production value, 8k resolution."",""onScreenText"":""SHOCKING SALARY REVEAL! 😲"",""videoPrompt"":""Slow zoom into the center chair of Shark Tank India, glowing logo in the background, fast glitch transitions.""},{""beat"":""5-15s The Reveal"",""imagePrompt"":""Illustration of three founders standing in front of sharks, a speech bubble showing '₹ 7,00,000 / Month', sharks looking stunned, digital art style."",""onScreenText"":""7 LAKH PER MONTH? 💸"",""videoPrompt"":""Focus on the shocked expressions of Shark-like avatars, fast cuts between the currency symbol and the founders' faces.""},{""beat"":""15-25s The Context"",""imagePrompt"":""Luxury travel luggage (Nasher Miles style) stacked neatly in a modern warehouse, bright lighting, focus on quality and scale."",""onScreenText"":""SCALE & REVENUE 📈"",""videoPrompt"":""Panning shot across colorful premium suitcases, followed by a graph showing a line shooting upwards.""},{""beat"":""25-35s The Lesson"",""imagePrompt"":""Professional man in a blazer explaining something on a whiteboard, 'Unit Economics' and 'Profit' written clearly, soft studio lighting."",""onScreenText"":""RULES OF THE GAME 🏗️"",""videoPrompt"":""Close up of a hand checking off 'Profit' and 'Unit Economics' on a digital tablet.""},{""beat"":""35-40s Outro"",""imagePrompt"":""A hand holding a smartphone showing a comment section, neon 'SUBSCRIBE' and 'COMMENT' signs in the background."",""onScreenText"":""JUSTIFIED OR NOT? 👇"",""videoPrompt"":""Dynamic text overlay popping up with the question 'JUSTIFIED?' while the background blurs out.""}],""whyViral"":""The 'Founder Salary' debate is a hot topic in the Indian startup ecosystem. Highlighting a specific viral moment from a popular show like Shark Tank India with a 'contrarian' take creates high engagement and debate in comments.""}";2026-06-11 05:08:06.209589+00;
