id;user_id;thread_id;topic;data;created_at;folder
d3737de5-11e8-4525-90b5-9289a58534f7;968de976-deb8-4d42-936b-0e4288e99c82;a3b10bd4-dc73-4cfa-bd7b-684165b09b51;The Indian Protein Powder Scandal: Toxic Additives and Mislabeling;"{""caption"":""India's Protein Crisis: 70% of popular supplements failed the lab test. 🧪 Is your 'health' drink actually toxic? \n\nNew research reveals heavy metals, pesticides, and fungal toxins in the tubs you trust. Stop being a lab rat for big brands. Watch till the end to know how to stay safe.\n\n#IndianFitness #ProteinScam #HealthAlert #GymMotivation #Supplements #FitnessIndia #Exposed #WaitForKey #HealthAwareness"",""format"":""Reel/Short"",""hashtags"":[""#IndianFitness"",""#ProteinScam"",""#GymControversy"",""#HealthAlert"",""#SupplementsIndia"",""#FitnessFacts"",""#HeavyMetals"",""#NutritionWaste"",""#WorkoutMotivation"",""#Exposed""],""niche"":""Fitness/Health Controversy"",""script"":{""dialogue"":""Kya aap jaante hain aapke protein bucket mein muscle ke saath saath zeher bhi ho sakta hai? Research mein pata chala hai ki India ke 70% popular protein supplements mislabeled hain. Sirf label hi nahi, 14% samples mein fungal toxins aur 8% mein harmful pesticides mile hain. Kuch brands mein toh lead aur arsenic jaise heavy metals bhi detect huye hain. Log sochte hain protein powder se liver damage hota hai, par sach toh ye hai ki ye nakli supplements aur pesticides aapka liver kharaab kar rahe hain. Har chamakti hui dabba quality nahi hoti. Supplement lene se pehle lab reports check kijiye aur blind trust band kijiye. Kyunki sehat banane chale the, kahin gawa na baitho."",""suggestedElevenLabsVoice"":{""name"":""Antoni"",""voiceId"":""exoL2Z47H69R4K2fmkZY""},""voiceDirection"":""Serious, fast-paced, urgent, and warning. Use deep pauses for emphasis on 'zeher' and 'mislabeled'.""},""sources"":[{""claim"":""70% of 36 popular protein supplements sold in India are mislabeled."",""url"":""https://www.instagram.com/p/DYSELlJB5vt/""},{""claim"":""14% of tested protein samples had fungal toxins and 8% had pesticides."",""url"":""https://www.instagram.com/reel/DZU_CKVFlgw/""},{""claim"":""Reports of heavy metals like lead and arsenic found in Indian protein supplements."",""url"":""https://www.instagram.com/reel/DZK9VHzPX-_/""}],""thumbnailPrompts"":[""Close-up of a protein scoop dripping with dark, oily sludge instead of powder. Large text: '70% FAKE PROTEIN?' with a warning sign. High contrast, gritty gym background."",""A muscular man looking shocked at a lab report. In the background, protein tubs with 'TOXIC' stamps. Text: 'POISON IN YOUR PROTEIN'. Dramatic lighting."",""Split screen: One side a shiny protein tub, other side a microscope view of bacteria and metal shards. Text: 'THE DARK TRUTH'. Neon red and white bold text.""],""topic"":""The Indian Protein Powder Scandal: Toxic Additives and Mislabeling"",""visuals"":[{""beat"":""0-3s hook"",""imagePrompt"":""Ultra-realistic close-up of a black protein tub being opened, but green toxic gas emerges instead of powder. Cinematic lighting, dark gym aesthetic."",""onScreenText"":""70% PROTEIN IS FAKE?"",""videoPrompt"":""Slow motion zoom into a protein tub as toxic neon green vapor swirls out. Camera shakes slightly for dramatic effect.""},{""beat"":""3-8s the data"",""imagePrompt"":""Splitscreen graphic. Left: A lab technician holding a test tube. Right: A list of 'Heavy Metals' and 'Pesticides' appearing in bold red font. Professional lab setting."",""onScreenText"":""LAB REPORTS EXPOSED"",""videoPrompt"":""Fast cuts between lab equipment, microscopes, and fitness enthusiasts drinking shakes with a 'glitch' effect overlay.""},{""beat"":""8-15s the danger"",""imagePrompt"":""A cinematic shot of a human liver glowing with a red warning light inside a body. Dark background. Symbolizing internal damage."",""onScreenText"":""HEAVY METALS & PESTICIDES"",""videoPrompt"":""3D medical animation showing toxic particles entering the bloodstream from a drink. Quick, aggressive camera movement.""},{""beat"":""15-22s the reality"",""imagePrompt"":""Crowded Indian supplement shop with shelves full of neon-colored tubs, but they all have a 'Hazard' sticker on them. Gritty, street-style photography."",""onScreenText"":""DONT BLINDLY TRUST BRANDS"",""videoPrompt"":""Panning shot across various supplement jars that slowly turn into skulls or warning signs as the camera passes.""},{""beat"":""22-30s call to action"",""imagePrompt"":""A fitness influencer looking directly into the camera with a serious expression, holding a phone showing a lab report. Moody gym lighting."",""onScreenText"":""STAY SAFE. CHECK REPORTS."",""videoPrompt"":""Handheld camera stabilizes on the speaker’s face as the background blurs. Final fade to black with a 'Share this' icon.""}],""whyViral"":""This topic taps into the high-anxiety 'Health & Safety' niche. It challenges the 'health' status of products millions of Indians use daily. High-retention hooks ('Zeher' and '70% Fake') and evidence-based shock value are proven to trigger mass shares among gym-goers and parents.""}";2026-06-12 06:50:52.165434+00;
3b8b7d09-c11e-4f76-b8b4-eb4aad2ad1b0;968de976-deb8-4d42-936b-0e4288e99c82;c30c3476-6fed-48c7-85a7-255bf2daaec2;Gym Heart Attack Myth vs Reality;"{""caption"":""Kya Gym jaana dangerous hai? 🏋️‍♂️💔 Let's debunk the 'Gym Heart Attack' myth with actual medical perspectives. Fitness is life, but only if you do it right. Tag your gym buddy! \n\n#HealthTips #GymMotivation #HeartHealth #FitnessIndia #MythBusters #Cardio #WorkoutRoutine #MedicalFacts #HealthyLifestyle"",""format"":""Reel/Short"",""hashtags"":[""GymLife"",""HeartAttack"",""FitnessMyths"",""HealthAwareness"",""IndianFitness"",""GymSafety"",""Wellness"",""ScienceExplained"",""HeartHealthAwareness"",""MythBuster""],""niche"":""Health & Fitness / Bio-hacking"",""script"":{""dialogue"":""Kya gym jaane se heart attack aata hai? Pichle kuch saalon mein fit young logo ke sudden collapse ne sabko dara diya hai. Lekin sach ye hai ki gym aapka dushman nahi hai. Doctors ke mutabiq, problem workout nahi, balki undiagnosed heart conditions, extreme lifestyle stress, smoking, steroid use aur sleep deprivation ho sakti hai. Indians mein heart disease 10 saal pehle develop hoti hai compared to others. Agar aap bina warmup ke seedha heavy lifting karte ho, ya body signals ko ignore karke apni limit ko push karte ho, toh risk badhta hai. Gym bura nahi hai, lekin blind training khatarnak hai. Health ke liye paji, pehle checkup, phir warmup, aur phir workout!"",""suggestedElevenLabsVoice"":{""name"":""Saurav - Deep & Explanatory"",""voiceId"":""IKneCnuwYf30v7X4K3mQ""},""voiceDirection"":""Serious, fast-paced, authoritative but reassuring. Start with a hook-like questioning tone, transition into a factual explanation, and end with a brotherly advice vibe.""},""sources"":[{""claim"":""Heart disease develops nearly 10 years earlier in Indians."",""publisher"":""SSB Heart And Multispecialty Hospital"",""url"":""https://www.instagram.com/reel/DZPiCwzSVRK/""},{""claim"":""Even athletes or slim individuals can have heart attacks due to smoking, genetic cholesterol disorders, steroid use, stress, sleep deprivation, or undiagnosed conditions."",""publisher"":""Hindustan Times"",""url"":""https://www.hindustantimes.com/lifestyle/health/hyderabad-doctor-debunks-10-common-myths-about-heart-attacks-highlights-real-concerns-related-to-the-condition-101778565730733.html""}],""thumbnailPrompts"":[""Split screen image: on one side a muscular man clutching his chest in a dark gym, on the other side a medical lung/heart scan in neon blue. Text: 'GYM = DEATH?' in bold yellow."",""A close-up of a person lifting heavy weights with a ticking clock overlaid. Cinematic lighting, high contrast. Text: 'THE SILENT RISK?' in red."",""Dramatic shot of a fit person looking at their reflection in a gym mirror, the reflection is a doctor holding an ECG report. Text: 'GYM MYTH DEBUNKED' in white.""],""topic"":""Gym Heart Attack Myth vs Reality"",""visuals"":[{""beat"":""0-3s Hook"",""imagePrompt"":""Cinematic low-angle shot of a sweating athlete dropping a heavy dumbbell, blurry gym background, high contrast, dramatic shadows."",""onScreenText"":""GYM SE HEART ATTACK? 💔🏋️‍♂️"",""videoPrompt"":""Slow motion shot of a dumbbell hitting the floor with dust rising, followed by a quick zoom into the athlete's worried face.""},{""beat"":""3-8s The Problem"",""imagePrompt"":""News montage style layout showing blurred headlines of fitness figures and hospital monitors, blue and red emergency lighting."",""onScreenText"":""SUDDEN COLLAPSES? 📉"",""videoPrompt"":""A fast-paced glitch transition between various news-style headlines about sudden cardiac arrest in young people.""},{""beat"":""8-15s The Real Reason"",""imagePrompt"":""Scientific 3D medical render of a human heart with glowing red zones, digital HUD overlays showing data points about 'Lifestyles' and 'Stress'."",""onScreenText"":""GYM IS NOT THE ENEMY ❌"",""videoPrompt"":""A 360-degree rotation around a 3D heart model showing arterial pathways lighting up, clean tech aesthetic.""},{""beat"":""15-22s The Indian Context"",""imagePrompt"":""A split screen showing a DNA helix on one side and an Indian man at a desk looking stressed on the other. Warm, earthy color grading."",""onScreenText"":""INDIANS @ HIGHER RISK? 🇮🇳"",""videoPrompt"":""An infographic animation showing a timeline comparing Western heart health age vs Indian heart health age.""},{""beat"":""22-30s Safety & Outro"",""imagePrompt"":""A fit person smiling and checking their heart rate on a smartwatch while warming up on a treadmill. Bright, natural morning light."",""onScreenText"":""CHECKUP > WORKOUT ✅"",""videoPrompt"":""A smooth tracking shot of a person doing a controlled bicep curl, followed by a thumbs up to the camera.""}],""whyViral"":""Capitalizes on the high fear/anxiety surrounding recent high-profile gym deaths in India while providing a science-backed 'safeguard' for fitness enthusiasts. Mixes controversy with helpful advice.""}";2026-06-12 06:53:02.838322+00;
74c770e5-d6ab-4a38-9027-256f27f8902e;fe7d32af-a848-4697-b205-62382fe8539b;15fc34fe-9cd0-4954-9909-ed2fa0dbc24e;Meta AI Pendant & Future Wearables;"{""caption"":""Smartphone ka zamana khatam? 📱 Meta ke hardware roadmap mein naya \""AI Pendant\"" aur \""Wearables for Work\"" ka zikr hai! AI wearables are coming for your phone. Would you wear this? 👇\n\n#Meta #AI #Zuckerberg #AIPendant #FutureTech #Wearables #Innovation #TechTrends #SmartGadgets #TheInformation"",""format"":""Short / Reel"",""hashtags"":[""#MetaAI"",""#Zuckerberg"",""#AIPendant"",""#FutureTech"",""#TechLeaks"",""#TechTrends"",""#SmartWearables"",""#GadgetNews"",""#AIRevolution""],""niche"":""Tech & Business"",""script"":{""dialogue"":""Mark Zuckerberg shayad aapke hath se phone nikal kar aapke gale mein latkana chahte hain. Meta ke ek memo se naye hardware plans samne aaye hain: Meta AI Pendant. Ye sirf ek fashion accessory nahi hai. Isme cameras aur mics ho sakte hain, jo aapke personal AI assistant ki tarah kaam karenge. Meta \""Wearables for Work\"" par focus kar raha hai—matlab meeting notes, emails aur tasks, sab kuch naye tarike se handle karne ki taiyari hai. Pehle AI Glasses aur ab ye Pendant concept. Kya aapko lagta hai wearable hardware hamare smartphones ko replace kar payega? Comments mein batao."",""suggestedElevenLabsVoice"":{""name"":""Rahul (Hinglish Narrative)"",""voiceId"":""pNInz6obpg8n9Y93sW2g""},""voiceDirection"":""Fast-paced, energetic, slightly mysterious, rhythmic cadence. High emphasis on \""Future\"" and \""Memo\"".""},""sources"":[{""claim"":""Meta plans AI pendant, expanded AI glasses offerings and “Wearables for Work” in ambitious new hardware roadmap."",""url"":""https://www.theinformation.com/articles/meta-memo-outlines-ambitious-hardware-plans-including-new-ai-pendant""}],""thumbnailPrompts"":[""A high-contrast cinematic shot of Mark Zuckerberg next to a glowing, futuristic metallic pendant. Bold text: 'BYE BYE SMARTPHONE?' in bright yellow. Dark studio background."",""Close up of a sleek, minimalist AI pendant on a person's chest, glowing with a soft blue AI light. Text: 'META'S NEW WEARABLE' in neon white. 4k resolution."",""Comparison layout: On the left, a smartphone. On the right, the Meta AI Pendant concept. Text: 'THE FUTURE OF PHONES?' in red and white. High tension.""],""topic"":""Meta AI Pendant & Future Wearables"",""visuals"":[{""beat"":""0-3s Hook"",""imagePrompt"":""Extreme close-up of Mark Zuckerberg's eyes reflecting a digital UI, dark cinematic lighting, tech corporate aesthetic. 8k resolution."",""onScreenText"":""SMARTPHONE KHATAM? 📱"",""videoPrompt"":""Fast zoom-in on Mark Zuckerberg's face in a dark tech-lab setting, flickering lights, glowing blue accents. 4k cinematic move.""},{""beat"":""3-7s Product Reveal"",""imagePrompt"":""A sleek, metallic circular pendant with a glass center and a tiny camera lens, floating in a void of digital particles. Hyper-realistic product photography."",""onScreenText"":""META AI PENDANT MEMO 🤫"",""videoPrompt"":""Smooth 360-degree rotation of a minimalist silver pendant, light glinting off the metal, slow-motion particle effects.""},{""beat"":""7-12s Functionality"",""imagePrompt"":""A person in a modern office, wearing the pendant; holographic UI icons for emails, mic, and calendar floating in front of them. Shot from hero angle."",""onScreenText"":""WEARABLES FOR WORK 💼"",""videoPrompt"":""Person walking through a busy street, the pendant glows slightly, a faint digital wave emitting from it toward the camera. Shot in 60fps.""},{""beat"":""12-16s Strategic Move"",""imagePrompt"":""Collage of Ray-Ban Meta glasses and the new Pendant side-by-side on a tech blueprint background. Tech-noir style."",""onScreenText"":""META'S HARDWARE PLAN 💸"",""videoPrompt"":""Dynamic split-screen showing Meta glasses on one side and the pendant on the other, fast glitch transitions.""},{""beat"":""16-20s Outro/CTA"",""imagePrompt"":""Close up of a hand reaching out to touch the pendant. Soft bokeh background. Warm lighting."",""onScreenText"":""NEXT BIG THING? COMMENT NOW! 👇"",""videoPrompt"":""Focus ramps from the pendant to the user's smiling face, blurring the background. Sudden cut to black at the end.""}],""whyViral"":""Leaks about tech giants like Meta always grab attention. The 'Future of Wearables' is a high-retention hook that triggers curiosity and debate about the future of hardware.""}";2026-06-12 18:45:50.105428+00;
7098cd36-eed3-46fb-83d6-cc1df4798c6d;fe7d32af-a848-4697-b205-62382fe8539b;12090bc9-c883-4c67-87ff-6ec130170132;The Rise of Digital Rupee vs UPI in India 2025;"{""caption"":""Is this the end of physical cash? 💸 RBI ka Digital Rupee (e₹) is changing everything. Not UPI, not Crypto—it’s official digital cash on your phone! #DigitalRupee #RBI #FintechIndia #FinanceNews"",""format"":""Reel/Short"",""hashtags"":[""#DigitalRupee"",""#RBI"",""#FintechIndia"",""#FinanceNews"",""#IndianEconomy"",""#UPIvsCBDC"",""#CryptoIndia"",""#MoneyMatters""],""niche"":""Finance & Fintech"",""script"":{""dialogue"":""Duniya cash bhul rahi hai, par kya aapne RBI ka naya e-Rupee dekha hai? Log confuse hain—kya ye UPI hai? Kya ye Bitcoin jaisa Crypto hai? Bilkul nahi. UPI sirf ek bank transfer tool hai, par e-Rupee khud ek 'Digital Note' hai. Iska matlab ab physical wallet ki zarurat nahi, kyunki aapka digital paisa ab sidha RBI ke pass hai. No bank server down, no middleman. Iske naye use-cases develop ho rahe hain—from offline payments to instant transfers. Kya India sach mein ‘Cashless’ hone wala hai? Aap batao—Digital Rupee ya Plastic Notes? Comment mein likho!"",""suggestedElevenLabsVoice"":{""name"":""Aditya (Hinglish)"",""voiceId"":""21mOQcy7kMoZkbc5pE5i""},""voiceDirection"":""Fast-paced, high energy, punchy. Emphasize keywords like 'Digital Note', 'RBI', and 'Bank server down'. Pause for 0.5s after the hook and before the final CTA. Pragmatic but visionary tone.""},""sources"":[{""claim"":""India's Digital Rupee e₹ is not crypto and not UPI - it's RBI-issued official digital cash."",""publisher"":""Instagram"",""url"":""https://www.instagram.com/p/DYqpRcumDPI/?img_index=5""},{""claim"":""Digital transactions may be available for specific use cases such as capital markets, insurance, government payments, travel, education, healthcare, and collections."",""publisher"":""ClearTax"",""url"":""https://www.facebook.com/clearfromcleartax/posts/comment-the-word-upi-to-get-this-pdf-into-your-dmsdigital-payments-in-india-have/1443269341174085/""},{""claim"":""The Reserve Bank of India issues press releases regarding fintech and digital banking reports."",""publisher"":""Reserve Bank of India"",""url"":""https://www.rbi.org.in/commonman/English/Scripts/PressReleases.aspx""}],""thumbnailPrompts"":[""9:16 vertical portrait thumbnail, 1080x1920px, high-impact, for YouTube Shorts / Instagram Reels. LAYOUT CONCEPT: Split composition with a sharp diagonal cut. SUBJECT: Extreme close-up of a 28-year-old Indian man's face on the right, jaw dropped in total shock, eyes wide with glassy catchlights, wearing a black tech-wear hoodie. BACKGROUND: Deep electric blue gradient with a faint digital binary pattern. TEXT OVERLAYS: MAIN HEADLINE 'RIP CASH' in 150pt ultra-bold white Anton font with a 10px black stroke and red outer glow, tilted 15 degrees. SUBTEXT 'RBI’s New Move' in bright yellow in the bottom third. COLOR PALETTE: #0000FF (Electric Blue), #FFFFFF (White), #FFFF00 (Yellow). LIGHTING: High-contrast rim light on the subject silhouette, harsh side lighting. STYLE: YouTube Shorts thumbnail aesthetic, hyperrealistic. --ar 9:16 --style raw --v 6.1 --q 2"",""9:16 vertical portrait thumbnail, 1080x1920px, high-impact, for YouTube Shorts / Instagram Reels. LAYOUT CONCEPT: Full-bleed centered subject. SUBJECT: An influential Indian woman in her late 20s, looking directly into the lens with an assertive, knowing smirk, holding a smartphone that is projecting a 3D holographic 'e₹' (Digital Rupee sign) into the air. BACKGROUND: Vibrant orange-to-magenta sunset mesh gradient. TEXT OVERLAYS: 'UPI IS GONE?' in massive black slab-serif text at the top, taking up 30% of the screen. 'The Truth' in small white text below it. COLOR PALETTE: #FF4500 (Orange), #FF00FF (Magenta), #000000 (Black). LIGHTING: Soft glam light on face, orange rim light from the 'hologram'. STYLE: Editorial tech-magazine cover. --ar 9:16 --style raw --v 6.1 --q 2"",""9:16 vertical portrait thumbnail, 1080x1920px, high-impact, for YouTube Shorts / Instagram Reels. LAYOUT CONCEPT: Three-part vertical stack. SUBJECT: Top part shows a close-up of hands tearing a physical 500-rupee note. Middle part shows a futuristic credit card with 'e-RUPEE' branding. Bottom part shows a green 'Transaction Successful' screen on a phone. BACKGROUND: Neutral dark grey textured concrete. TEXT OVERLAYS: 'CASH VS DIGITAL' in bold white Impact font in the middle section. EMOJI: 💸 vs 📱. COLOR PALETTE: #333333 (Grey), #FFFFFF (White), #00FF00 (Green). LIGHTING: Top-down dramatic spotlighting. STYLE: High-impact documentary aesthetic. --ar 9:16 --style raw --v 6.1 --q 2""],""topic"":""The Rise of Digital Rupee vs UPI in India 2025"",""visuals"":[{""beat"":""0-3s hook: Cash khataam?"",""imagePrompt"":""9:16 vertical portrait format, 1080x1920px, shot for Instagram Reels / YouTube Shorts. SUBJECT: An extreme close-up of an Indian street vendor's weathered hand holding a 500-rupee note that is literally dissolving into 3D glowing blue digital pixels at the top edge. SCENE: A bustling, motion-blurred Mumbai street market at night with warm yellow lamps. CAMERA: 35mm lens, low angle, macro-detail on the note. LIGHTING: Warm orange ambient light from market stalls contrasted with a sharp neon blue glow from the pixelation effect. STYLE: Cinematic hyperrealism with a sci-fi twist. MOOD: Dramatic. --ar 9:16 --style raw --v 6.1"",""onScreenText"":""CASH KHATAM? 💸"",""videoPrompt"":""9:16 vertical portrait video, 1080x1920, for short-form. DURATION: 3 seconds. OPENING FRAME: Close-up of a paper rupee note. MOTION: The camera slow-zooms into the Gandhi portrait on the note as it suddenly glitches and ripples, turning into a glowing digital currency symbol. High-speed shutter look for grit. STYLE: Cinematic documentary. LIGHTING AND COLOR: Warm orange to electric blue.""},{""beat"":""3-8s: UPI vs e-Rupee confusion."",""imagePrompt"":""9:16 vertical portrait format, 1080x1920px, shot for Instagram Reels / YouTube Shorts. SUBJECT: A 25-year-old Indian tech vlogger sitting in a modern studio, looking confusedly at two giant floating holographic icons: the UPI logo on the left and the new RBI Digital Rupee (e-Rupee) logo on the right. SCENE: Minimalist dark studio with soundproofing foam panels. CAMERA: 50mm lens, eye-level, medium shot. LIGHTING: Dual-tone lighting (blue from one side, orange from the other), soft box main light. STYLE: Tech-influencer vlog aesthetic. MOOD: Curious. --ar 9:16 --style raw --v 6.1"",""onScreenText"":""Not UPI. Not Crypto. 🚫"",""videoPrompt"":""9:16 vertical portrait video, 1080x1920, for short-form. DURATION: 5 seconds. OPENING FRAME: Subject looking at a phone screen. MOTION: Rapid camera pan between the two floating icons as they rotate. The subject looks between them with an exaggerated \""What?\"" expression. Smooth cinematic glide. STYLE: 4K High-end tech review style. LIGHTING: Moody neon.""},{""beat"":""8-15s: Direct RBI liability / No bank down."",""imagePrompt"":""9:16 vertical portrait format, 1080x1920px, shot for Instagram Reels / YouTube Shorts. SUBJECT: A conceptual 3D render of a solid golden 'e₹' coin standing tall and glowing while a massive traditional stone bank building in the background is flickering and becoming transparent/ghostly. SCENE: A digital financial grid world with glowing data lines on the floor. CAMERA: Wide angle 16mm lens, low angle looking up to make the coin look heroic. LIGHTING: Golden hour warmth on the coin, cold digital blue on the fading bank. STYLE: High-end 3D motion graphic still. MOOD: Epic. --ar 9:16 --style raw --v 6.1"",""onScreenText"":""Direct Power of RBI 🏦💪"",""videoPrompt"":""9:16 vertical portrait video, 1080x1920, for short-form. DURATION: 7 seconds. OPENING FRAME: A bank building with \""Server Down\"" text on a red digital screen. MOTION: A pulse of blue light (the Digital Rupee) travels from a phone directly towards a massive 3D RBI logo, bypassing the bank entirely. Camera pushes forward through the light pulse. STYLE: Tech-abstract motion graphics. LIGHTING: Pulsing electric currents.""}],""whyViral"":""The confusion between UPI and the Digital Rupee (CBDC) is a massive trending topic in the Indian fintech space. People looking for alternatives to bank server failures on UPI are turning to the Digital Rupee as a possible solution. It addresses a real interest in the future of money with a dramatic hook.""}";2026-06-12 20:23:42.570794+00;
