id;user_id;thread_id;topic;data;created_at;folder
baf0ee62-f8d6-46fc-be1f-0342cd0c924a;fe7d32af-a848-4697-b205-62382fe8539b;;Burger King's savage agency pivot following a viral social media moment.;"{""caption"":""Burger King just won the marketing game with ONE viral moment. 🍔🔥 No professional cameras, just pure chaos and a savage swipe at the competition. This is how you change the game in 2024. \n\n#BurgerKing #MarketingWar #MojoSupermarket #McDonalds #BusinessStrategy #ViralMarketing #Whopper #BusinessNews"",""format"":""Reels/Shorts"",""hashtags"":[""#BurgerKing"",""#MarketingStrategy"",""#McDonalds"",""#BusinessNews"",""#ViralMoments"",""#MojoSupermarket"",""#AdAgency"",""#SocialMediaMarketing"",""#Creativity"",""#BrandWars""],""niche"":""Business & Marketing Strategy"",""script"":{""dialogue"":""Marketing ki duniya mein tabahi mach gayi hai! Burger King ne abhi do naye agencies ko sign kiya hai, aur wajah? Ek viral Whopper video! Story yeh hai: Ek video viral hua jo McDonald’s ke ek moment ka mazak uda raha tha. Enter: Mojo Supermarket. Unhone ek simple video nikaala jo seedha McDonald’s ki chuti le raha tha. Result? BK ne Mojo Supermarket ko apna U.S. social agency of record bana diya! Lesson? Aaj kal bade production sets nahi, fast timing aur thoda savage attitude viral hota hai. Burger King ka yeh move genius hai ya risky? Comment mein batao!"",""suggestedElevenLabsVoice"":{""name"":""Ravi (Indian Male Voice)"",""voiceId"":""21m0ndEVUK4490WE5jT1""},""voiceDirection"":""High-energy, punchy, sarcastic, and fast-paced. Use sharp pauses after 'Enter: Mojo Supermarket' and 'Result?'. Fast transition at the end.""},""sources"":[{""claim"":""Burger King names 2 new agencies following viral Whopper bite moment. Mojo Supermarket, now the chain's U.S. social AOR, claimed credit for a video swiping at McDonald's CEO."",""url"":""https://retailwit.com/how-gstv-steps-up-audience-targeting-with-stagwells-agentic-system/""}],""thumbnailPrompts"":[""9:16 vertical portrait thumbnail, 1080x1920px, high-impact, for YouTube Shorts / Instagram Reels. Split composition: Top 50% features a high-resolution, slightly distorted close-up of a McDonald's Big Arch burger with a giant red 'MISS' stamp over it. Bottom 50% shows a Burger King Whopper with a glowing 'VIRAL' neon sign. TEXT OVERLAYS: 'BK ROASTS MCDONALD’S' in massive, thick yellow font with a heavy black outline across the center. SUBTEXT: 'CEO gets trolled' in white at the very bottom. COLOR PALETTE: Red #DA291C, Yellow #FFC72C, Dark Blue #0033A0. Lighting is intense with a central spotlight effect. --ar 9:16 --style raw --v 6.1 --q 2"",""9:16 vertical portrait thumbnail, 1080x1920px, high-impact, for YouTube Shorts / Instagram Reels. Full-bleed layout: Extreme close-up of a young, trendy creative director (South Asian male, glasses, beard) holding a smartphone toward the camera, showing a blurry frame of the viral Burger King video. The man has a smirk, 'Ooh' expression. TEXT OVERLAYS: 'MISTAKE REWARDED' in bold white font with a red drop shadow in the top third. '₹CR Agency Deal' in neon green at the bottom. COLOR PALETTE: Neon Green #39FF14, Black #000000, White #FFFFFF. Lighting: Dramatic teal and orange rim lighting. --ar 9:16 --style raw --v 6.1 --q 2"",""9:16 vertical portrait thumbnail, 1080x1920px, high-impact, for YouTube Shorts / Instagram Reels. Three-part stack layout: Top panel shows McDonald's CEO looking confused; Middle panel shows the viral Whopper bite frame; Bottom panel shows the Mojo Supermarket logo. TEXT OVERLAYS: 'THE $1B BITE' in yellow dripping font (horror/gritty style), centered. 'BK Won' in bright blue bubble text top right. COLOR PALETTE: Deep Red #8B0000, Bright Yellow #FFFF00, Black #000000. Lighting: High-contrast shadows, cinematic noir style. --ar 9:16 --style raw --v 6.1 --q 2""],""topic"":""Burger King's savage agency pivot following a viral social media moment."",""visuals"":[{""beat"":""0-3s hook"",""imagePrompt"":""9:16 vertical portrait format, 1080x1920px, shot for Instagram Reels / YouTube Shorts. A split-screen visual: On the left, a blurry, paparazzi-style shot of a corporate CEO in a suit taking a hesitant bite of a burger. On the right, a vibrant, high-contrast Burger King Whopper with flames in the background. Lens: 35mm. Lighting: Harsh, high-contrast street lighting. Text overlay: 'THE BITE THAT CHANGED EVERYTHING' in bold white impact font at the top. Mood: Chaotic, urgent. --ar 9:16 --style raw --v 6.1"",""onScreenText"":""THE VIDEO THAT CHANGED EVERYTHING"",""videoPrompt"":""9:16 vertical portrait video, 1080x1920, for short-form. 3 seconds. The camera aggressively zooms in on a burger being bitten. Quick glitch effect transitions between the CEO biting and the Burger King logo flashing. Style reference: Fast-paced hype video. Lighting: Flashing red and yellow lights. --ar 9:16 --style raw --v 6.1""},{""beat"":""4-8s context"",""imagePrompt"":""9:16 vertical portrait format, 1080x1920px, shot for Instagram Reels / YouTube Shorts. A clean, modern office interior with 3 Gen-Z creatives sitting around a laptop, high-fiving. They are dressed in fashionable streetwear (over-sized hoodies, beanies). On the laptop screen, a social media dashboard is visible. Lens: 24mm wide-angle. Lighting: Bright, natural window light mixed with purple neon desk lamps. Style: Trendy startup vibe. Mood: Victorious. --ar 9:16 --style raw --v 6.1"",""onScreenText"":""MOJO SUPERMARKET WINS"",""videoPrompt"":""9:16 vertical portrait video, 1080x1920, for short-form. 4 seconds. Handheld camera movement, orbiting the group of creatives as they cheer and point at a screen. One girl spins in her chair. Smooth cinematic motion. Style: Documentary style. --ar 9:16 --style raw --v 6.1""},{""beat"":""9-15s the drama"",""imagePrompt"":""9:16 vertical portrait format, 1080x1920px, shot for Instagram Reels / YouTube Shorts. A close-up of a smartphone held by a hand with tattoos, scrolling through a viral Twitter (X) thread. The thread shows side-by-side screenshots of McDonald's vs Burger King. Lens: 50mm macro. Lighting: The blue glow from the phone screen illuminates the person's face. Style: Mood, tech-focused. Mood: Intense. --ar 9:16 --style raw --v 6.1"",""onScreenText"":""SAVAGE MARKETING..."",""videoPrompt"":""9:16 vertical portrait video, 1080x1920, for short-form. 6 seconds. A slow dolly push towards the smartphone screen while blurred figures move quickly in the background representing 'the internet'. Text bubbles start popping up around the phone showing 'LOL' and 'BK WINS'. --ar 9:16 --style raw --v 6.1""},{""beat"":""16-20s conclusion/CTA"",""imagePrompt"":""9:16 vertical portrait format, 1080x1920px, shot for Instagram Reels / YouTube Shorts. An Indian male influencer, mid-20s, looking directly into the lens with a 'thinking' gesture (hand on chin). He is in a modern studio with a blurred background of urban city lights. Lens: 85mm. Lighting: Soft three-point lighting with a blue rim light. Style: High-end lifestyle creator. Mood: Provocative. Text overlay: 'GENIUS OR RISKY?' at the bottom. --ar 9:16 --style raw --v 6.1"",""onScreenText"":""GENIUS OR RISKY? COMMENT BELOW!"",""videoPrompt"":""9:16 vertical portrait video, 1080x1920, for short-form. 4 seconds. The influencer points to the camera, then points down to where the comment section would be. Subtle head tilt and smirk. Slow zoom-in on his face. Cinematic lighting. --ar 9:16 --style raw --v 6.1""}],""whyViral"":""This story works because it taps into the 'Brand War' trope (BK vs McDonald's) which always gets high engagement. It highlights a moment where a creative agency (Mojo Supermarket) won a massive contract by being 'savage' on social media, appealing to the current trend of reactive marketing over polished ads.""}";2026-06-14 20:38:52.912023+00;
9ebb6d50-ba80-4e9b-aa69-addc20774365;fe7d32af-a848-4697-b205-62382fe8539b;1c1fc1bf-1f29-4ece-9acc-684648fb9f26;Zepto Business Model Decoded;"{""caption"":""10 minutes mein delivery kaise? 🤯 Zepto ka 'Dark Store' secret decoded! 🛒⚡️\n\nEk 58,000 Crore ki company. Par kaise? It's not just bikes, it's deep logistics. \n\nSuno Zepto ka simplified business model is 30 second ki video mein. \n\n#Zepto #StartupIndia #BusinessModel #Entrepreneurship #QuickCommerce #SuccessStory #Hinglish #MoneyMindset"",""format"":""Instagram Reel / YouTube Short"",""hashtags"":[""#Zepto"",""#BusinessStrategy"",""#StartupIndia"",""#QuickCommerce"",""#Entrepreneurship"",""#MoneyMindset"",""#Logistics"",""#BillionDollarIdea"",""#HinglishContent"",""#MarketingStrategy""],""niche"":""Business & Startups"",""script"":{""dialogue"":""Aapko lagta hai Zepto itni jaldi delivery sirf fast driving se karta hai? Galat. Inka asli secret inki bikes nahi, inke 'Dark Stores' hain. Zepto ne poore sheher mein mini-warehouses ka ek jaal bichhaya hai, jo high-demand areas ke paas hote hain. Jab aap order karte ho, toh efficient picking systems se saaman pack hota hai. Delivery partner ko kam distance travel karna padta hai, isliye 10 minute mein bell baj jaati hai. ₹58,000 Crore ki valuation sirf speed ki nahi, smart logistics ka kamaal hai!"",""suggestedElevenLabsVoice"":{""name"":""Aditya (Indian Male)"",""voiceId"":""Xb7hHjz9S8qM1N2O9w45""},""voiceDirection"":""Fast-paced, energetic, punchy. Natural Hinglish flow with emphasis on 'Dark Stores'. No robotic pauses.""},""sources"":[{""claim"":""Two dropouts built a 58, 000 crore company."",""url"":""https://www.instagram.com/p/DZeJUb-Gdyg/""},{""claim"":""It works by placing small warehouses called dark stores inside residential neighbourhoods."",""url"":""https://zopping.com/blog/quick-commerce/""},{""claim"":""The routing software and demand forecasting capability are documented as key enablers of near-10-minute delivery times."",""url"":""https://www.markhub24.com/post/delivery-as-a-product-how-zepto-s-dark-store-model-engineered-india-s-quick-commerce-category""}],""thumbnailPrompts"":[""9:16 vertical portrait thumbnail, 1080x1920px, high-impact, for YouTube Shorts / Instagram Reels. Split composition: Top 60% features an extreme close-up of a shocked Indian man (20s) with his hand over his mouth, eyes wide, wearing a simple purple hoodie. Bottom 40% is a bright neon yellow background with bold black text. MAIN HEADLINE: '10 MIN SECRET' in thick Impact font, slightly tilted. SUBTEXT: 'Not just bikes!' with a tiny red X emoji. Background behind the man has a blurred Zepto delivery bag. Color palette: Purple #4B0082, Neon Yellow #CCFF00, White #FFFFFF. Dramatic rim lighting on the subject's face. --ar 9:16 --style raw --v 6.1 --q 2"",""9:16 vertical portrait thumbnail, 1080x1920px, high-impact, for YouTube Shorts / Instagram Reels. Full-bleed composition: A high-tech 'Neural Map' of a city like Mumbai with glowing purple dots (representing Dark Stores) connected by neon lines. Centered in the middle is a giant high-res Zepto delivery crate. TEXT OVERLAY: '₹58,000 CRORE LOGIC' in ultra-bold white font with a deep purple drop shadow, taking up the center-third. Top corner has a stopwatch icon showing 10:00. Color palette: Deep Galaxy Purple #2D004D, Electric Blue #00FFFF, White #FFFFFF. Cinematic atmospheric lighting with lens flares. --ar 9:16 --style raw --v 6.1 --q 2"",""9:16 vertical portrait thumbnail, 1080x1920px, high-impact, for YouTube Shorts / Instagram Reels. Three-part vertical stack: Top section shows a blurred Zepto rider in a purple jersey on a scooter. Middle section has bold yellow text 'ZEPTO KA DARK SECRET' on a black background. Bottom section shows a detailed top-down view of a warehouse worker quickly grabbing a packet of chips. High contrast, saturated colors. Color palette: Zepto Purple #5F33FF, Safety Orange #FF9900, Deep Black #000000. Hyperrealistic editorial style. --ar 9:16 --style raw --v 6.1 --q 2""],""topic"":""Zepto Business Model Decoded"",""visuals"":[{""beat"":""0-5s Hook: The delivery myth"",""imagePrompt"":""9:16 vertical portrait format, 1080x1920px, shot for Instagram Reels / YouTube Shorts. An Indian Zepto delivery partner in a purple t-shirt, mid-action, riding a electric scooter through a blurred city street at golden hour. The camera is a low-angle tracking shot, creating a sense of extreme speed. Motion blur on the background buildings. Subject has a determined expression, wearing a black helmet. Lighting is warm from the setting sun with hard highlights on the bike's chrome parts. Mood: Energetic. TEXT OVERLAY: \""FAST DRIVING?\"" across the middle in bold white sans-serif font. --ar 9:16 --style raw --v 6.1"",""onScreenText"":""Fast Driving? 🚫"",""videoPrompt"":""9:16 vertical portrait video, 1080x1920, for short-form. 5 seconds. Opening frame is a close-up of a spinning scooter wheel. Motion: The camera pans up rapidly to the rider's face as he navigates traffic, then zoom-cuts to a large red 'X' appearing over the screen. Ended with a glitch effect transitioning to the next scene. Cinematic handheld style. High contrast color grade.""},{""beat"":""5-15s: The Dark Store Reveal"",""imagePrompt"":""9:16 vertical portrait format, 1080x1920px, shot for Instagram Reels / YouTube Shorts. Interior of a 'Dark Store', a high-tech mini warehouse with rows of organized metal shelves stocked with groceries. A 20-year-old Indian worker is seen from the back, holding a handheld scanner that glows blue. Lighting is cool-toned fluorescent with purple LED strips along the aisles. Camera is a wide-angle 16mm shot from the corner, looking down the aisle. Style is hyperrealistic documentary. Mood: Busy and efficient. TEXT OVERLAY: \""DARK STORES\"" in neon purple font at the top. --ar 9:16 --style raw --v 6.1"",""onScreenText"":""Inka Real Secret: DARK STORES 🏪"",""videoPrompt"":""9:16 vertical portrait video, 1080x1920, for short-form. 10 seconds. Opening frame is a sliding door opening to reveal the warehouse. Motion: A fast dolly-in through the warehouse aisle. We see workers' hands moving at 2x speed, grabbing items from shelves. Camera cuts between close-ups of product barcodes being scanned. End frame is a packed grocery bag being zipped shut. Fast-cut editing style. Cool blue/purple color grade.""},{""beat"":""15-25s: Logistics Logic"",""imagePrompt"":""9:16 vertical portrait format, 1080x1920px, shot for Instagram Reels / YouTube Shorts. A 3D isometric graphic of a city neighborhood map. A bright purple circle highlights a 2km radius around a central 'Dark Store' icon. Delivery icons are seen moving within this circle. The camera is a top-down birds-eye view focusing on the logistics flow. Clean, minimalist graphic style with vibrant neon accents. Lighting is artificial, studio-lit graphic look. Mood: Analytical. ON-SCREEN TEXT: \""2km Radius Only\"" in a bottom corner box. --ar 9:16 --style raw --v 6.1"",""onScreenText"":""Efficient Picking ⏱️ / Fast Delivery 📍"",""videoPrompt"":""9:16 vertical portrait video, 1080x1920, for short-form. 10 seconds. Opening frame is a digital stopwatch counting down from 60 to 0. Motion: The camera pans across a digital map of Bangalore or Mumbai, showing purple delivery lines radiating from stores. The lines move quickly. Ending frame is a delivery bag being handed over a doorstep. Smooth cinematic drone-like motion on the map. High saturation.""},{""beat"":""25-30s: Outro: The Valuation"",""imagePrompt"":""9:16 vertical portrait format, 1080x1920px, shot for Instagram Reels / YouTube Shorts. A portrait of two young Indian founders (Aadit Palicha and Kaivalya Vohra), standing side-by-side in front of a modern glass office building. They are wearing casual t-shirts and smiling confidently. Camera is a medium-shot, eye-level, using an 85mm lens for soft background bokeh. Sunlight is bright and optimistic. Style is corporate editorial. TEXT OVERLAY: \""₹58,000 CRORE\"" in bold gold letters centered on screen. --ar 9:16 --style raw --v 6.1"",""onScreenText"":""₹58,000 CRORE Logic! 📈🚀"",""videoPrompt"":""9:16 vertical portrait video, 1080x1920, for short-form. 5 seconds. Opening frame is a close-up of the Zepto logo. Motion: The camera pulls back to reveal the founders, then a rapid zoom-in on the '₹58,000 CR' text as it pops onto the screen with a 'ping' sound effect. Ending frame is a call-to-action to 'Follow for more Biz stories'. Clean professional look. Warm golden hour grade.""}],""whyViral"":""The 'Speed vs Logic' hook debunking the myth that delivery speed is just about tires/gas is highly engaging. Using high-value numbers (₹58k Cr) and the 'Dark Store' buzzword creates curiosity. Hyper-fast editing matches the brand's identity.""}";2026-06-14 20:41:12.480051+00;
efb3471b-fc53-4329-b6bd-6240f0a47dfe;fe7d32af-a848-4697-b205-62382fe8539b;19d2b06d-44ab-425f-b76c-df6e802a3b5f;Burger King vs McDonald's: The Viral Bite War;"{""caption"":""Burger King just won the marketing war with a single bite. 🍔🔥 McDonald’s CEO tried for a big launch, but an awkward, tiny bite became a viral meme. BK didn't waste a second—turning a corporate fail into a social media masterclass. This is why Burger King is the King of Petty Marketing. 👑\n\n#BurgerKing #McDonalds #MarketingStrategy #BusinessNews #BigArch #ViralMarketing #CorporateWar #MarketingTips"",""format"":""Reel/Short"",""hashtags"":[""#BurgerKing"",""#McDonalds"",""#MarketingWar"",""#BusinessTrend"",""#ViralVideo"",""#MarketingGenius"",""#FastFoodWar"",""#SocialMediaStrategy""],""niche"":""Business/Marketing Strategy"",""script"":{""dialogue"":""McDonald’s ne ek nayi burger launch ki—The Big Arch. Aur iske promotions ke liye khud CEO screen par aaye. Lekin ek choti si galti ne Burger King ko jeetne ka mauka de diya. CEO ne burger ka itna chota aur awkward bite liya ki poora internet unka mazak banane laga. People called it the 'microscopic bite'. Burger King ne bilkul wait nahi kiya. Unhone ek savage response ke saath dikhaya ki king-sized burger ko asliyat mein kaise khaya jata hai. Result? Massive viral reach aur McDonald’s ki puri PR team ki mehnat par pani phir gaya. Burger King ne haal hi mein Coyne PR ko bhi hire kiya hai for its public relations. Lesson simple hai: Business mein spotlight milna mushkil hai, par doosre ki galti ko spotlight banana genius hai. Video achi lagi toh follow karo."",""suggestedElevenLabsVoice"":{""name"":""Antoni"",""voiceId"":""pNInz6OBpguXjS4X8B8D""},""voiceDirection"":""Energetic, fast-paced, slightly sarcastic, punchy delivery with pauses for emphasis.""},""sources"":[{""claim"":""Burger King Corp. has named Coyne Public Relations of Parsippany, N.J., as its public relations agency of record."",""publisher"":""Nation's Restaurant News"",""url"":""https://www.nrn.com/fast-casual/burger-king-picks-new-pr-agency""},{""claim"":""Explore the lesson behind McDonald's CEO's viral burger taste test and its implications for personal branding. ... The viral “Big Arch Burger” moment"",""publisher"":""TikTok"",""url"":""https://www.tiktok.com/@bristol_food_blogger/video/7647490436348579094""}],""thumbnailPrompts"":[""9:16 vertical portrait thumbnail, 1080x1920px, high-impact, for YouTube Shorts / Instagram Reels. LAYOUT CONCEPT: Split-screen vertical comparison. TOP HALF: Close-up of a nervous CEO-type figure in a suit holding a burger, mouth barely open for a tiny bite, 'MCDONALDS CEO' text in red impact font. BOTTOM HALF: Extreme close-up of a bearded man with a crown (Burger King style) taking a massive, messy, joyous bite of a dripping burger, 'REAL KING BITE' in yellow bold font. COLOR PALETTE: Red #DA291C, Yellow #FFC72C, White #FFFFFF. LIGHTING: Harsh top light on the top half, warm cinematic glow on the bottom half. STYLE: High-contrast commercial photography. --ar 9:16 --style raw --v 6.1 --q 2"",""9:16 vertical portrait thumbnail, 1080x1920px, high-impact, for YouTube Shorts / Instagram Reels. LAYOUT CONCEPT: Three-part stack. TOP: Main Headline 'BK ROASTS MCDONALDS' in ultra-bold white slab font with black stroke, taking up 30% of space. MIDDLE: Shocked reaction face of an Indian creator, hand over mouth, eyes wide. BOTTOM: A viral tweet mockup showing the BK logo with a 'Savage' tag. COLOR PALETTE: Royal Blue #003399, Burger Orange #F5EB16, White. LIGHTING: Bright ring light reflection in eyes, high clarity. STYLE: YouTube Thumbnail aesthetic with saturated colors. --ar 9:16 --style raw --v 6.1 --q 2"",""9:16 vertical portrait thumbnail, 1080x1920px, high-impact, for YouTube Shorts / Instagram Reels. LAYOUT CONCEPT: Full-bleed dramatic portrait. SUBJECT: A person in a sleek black hoodie looking at a phone screen which is glowing and reflecting the Burger King logo in their glasses. Their expression is a smirk/knowing smile. TEXT OVERLAY: 'MARKETING WAR' in massive 3D metallic font across the center. SUBTEXT: 'Mojo Supermarket's First Revenge' at the bottom. COLOR PALETTE: Dark Navy #0B0E11, Neon Yellow #FBBC05, Fire Orange. LIGHTING: Dramatic rim lighting from the phone screen, dark moody background. STYLE: Cyber-corporate cinematic. --ar 9:16 --style raw --v 6.1 --q 2""],""topic"":""Burger King vs McDonald's: The Viral Bite War"",""visuals"":[{""beat"":""0-5s Hook: The Failed Bite"",""imagePrompt"":""9:16 vertical portrait format, 1080x1920px, shot for Instagram Reels / YouTube Shorts. SUBJECT: A middle-aged corporate man in a premium gray suit, looking extremely stiff and uncomfortable, holding a massive gourmet burger with both hands. He is taking a tiny, 'microscopic' bite that barely touches the bun. SCENE: A high-end corporate boardroom with glass walls in the background, daytime. CAMERA: Tight close-up on the face and burger, eye-level, 35mm lens. LIGHTING: Bright, sterile office lighting. STYLE: Documentary-style realism with a hint of awkwardness. MOOD: Cringe. TEXT OVERLAY: 'MCDONALD'S CEO FAIL' in bold red font at the top. --ar 9:16 --style raw --v 6.1"",""onScreenText"":""CEO'S BIG ARCH FAIL 🍔"",""videoPrompt"":""9:16 vertical portrait video, 1080x1920, for short-form. DURATION: 5 seconds. OPENING FRAME: Tight shot of the burger. MOTION: Slow zoom into the CEO's face as he hesitates, then takes a tiny, awkward bite. His eyes look slightly panicked. Handheld camera shake for a 'caught on camera' feel. ENDING FRAME: Freeze frame on the tiny bite. STYLE: Modern social media documentary. LIGHTING: Bright, slightly overexposed.""},{""beat"":""5-12s The BK Reaction"",""imagePrompt"":""9:16 vertical portrait format, 1080x1920px, shot for Instagram Reels / YouTube Shorts. SUBJECT: A younger, cool creator wearing a Burger King crown, sitting in a dimly lit, neon-soaked room. He is holding a flaming burger and looking at his phone with a smirk. SCENE: Modern agency office with 'Mojo Supermarket' style aesthetic—cool posters and neon lights. CAMERA: Low angle shot looking up, 24mm wide lens. LIGHTING: Blue and orange neon rim light, moody contrast. STYLE: Hyper-cinematic, high energy. MOOD: Savage. TEXT OVERLAY: 'BURGER KING IS PETTY' in bold yellow. --ar 9:16 --style raw --v 6.1"",""onScreenText"":""BK JUST WENT SAVAGE 🔥"",""videoPrompt"":""9:16 vertical portrait video, 1080x1920, for short-form. DURATION: 7 seconds. OPENING FRAME: Fast whip-pan from the phone screen to the creator's face. MOTION: The creator laughs and starts typing rapidly. The background environment zooms in a 'dolly-zoom' effect. Rapid-fire cuts of Burger King's social media logo. ENDING FRAME: Intense stare into the camera. STYLE: High-octane music video edit. LIGHTING: Flashing orange and white lights.""},{""beat"":""12-20s The New Strategy/Conclusion"",""imagePrompt"":""9:16 vertical portrait format, 1080x1920px, shot for Instagram Reels / YouTube Shorts. SUBJECT: A group of creative marketing professionals in a high-tech war room, looking at data screens showing viral charts and burger emojis. One woman in the center is pointing at a screenshot of the viral video. SCENE: A sleek, dark minimalist office with large data dashboards. CAMERA: Medium wide shot, slow dolly-in. LIGHTING: Glow from the screens illuminating their faces, cool teal and white tones. STYLE: Professional, sleek editorial. MOOD: Triumphant. TEXT OVERLAY: 'MARKETING GENIUS' in clean white font at the bottom. --ar 9:16 --style raw --v 6.1"",""onScreenText"":""LESSON: BE SAVAGE 📈"",""videoPrompt"":""9:16 vertical portrait video, 1080x1920, for short-form. DURATION: 8 seconds. OPENING FRAME: Dashboard showing 'VIRAL' in green letters. MOTION: Smooth dolly-in past the team towards the main screen. The screen changes from a burger to the Burger King 'Crown' logo. Camera tilts up to a portrait of the 'King'. ENDING FRAME: High-contrast Burger King logo on a black background. STYLE: Cinematic corporate thriller. LIGHTING: Top-down spotlight.""}],""whyViral"":""The video taps into the 'Brand Wars' trope which is highly engaging (BK vs McDs). It uses a recent viral meme—the CEO's awkward bite—as a hook, combining corporate news with relatable humor. The angle centers on 'savagery' and marketing genius, which resonates with both business enthusiasts and casual viewers.""}";2026-06-14 20:42:07.509467+00;
